short_description,header_image,categories,genres
"Batla is the awesome shooter game about robots, which came to conquer the Earth, but turned to be were too small for that. They had no choice but to capture the kid's room and start fighting there.",https://shared.akamai.steamstatic.com/store_item_assets/steam/apps/338180/header.jpg?t=1644965039,"Multi-player, Cross-Platform Multiplayer, Steam Achievements, Steam Trading Cards, Family Sharing","Action, Free To Play"
"As a vow to his dying Master, the young swordsman Hiroki is sworn to protect his town and the people he loves against all threats. Faced with tragedy and bound to duty, the lone samurai must voyage beyond life and death to confront himself and decide his path forward.",https://shared.akamai.steamstatic.com/store_item_assets/steam/apps/1370050/header.jpg?t=1728950386,"Single-player, Steam Achievements, Full controller support, Steam Trading Cards, Steam Cloud, Family Sharing","Action, Adventure"
"Legendary shoot-'em-up makes its way on the PCs! Abundant explosions, truly epic boss fights and beautifully crafted 3D environments are here to keep you entertained. Sky Force Anniversary offers single player experience and local cooperative mode for 2 players.",https://shared.akamai.steamstatic.com/store_item_assets/steam/apps/355050/header.jpg?t=1667208034,"Single-player, Multi-player, Shared/Split Screen, Steam Achievements, Full controller support, Steam Trading Cards, Steam Cloud, Steam Leaderboards, Remote Play on TV, Remote Play Together, Family Sharing","Action, Indie"
"In a world torn by war, the aged gremlin archaeologist Mortimer MacGuffin harbors the dark secret of a powerful artifact.",https://shared.akamai.steamstatic.com/store_item_assets/steam/apps/215160/header.jpg?t=1725012492,"Single-player, Remote Play on Tablet, Family Sharing",Adventure
"Siralim Ultimate is a monster-catching, dungeon-crawling RPG with a ridiculous amount of depth. Summon over 1200 different creatures and travel through randomly generated dungeons to acquire resources, new creatures, and loot.",https://shared.akamai.steamstatic.com/store_item_assets/steam/apps/1289810/header.jpg?t=1756135333,"Single-player, Steam Achievements, Full controller support, Steam Trading Cards, Color Alternatives, Custom Volume Controls, Adjustable Difficulty, Keyboard Only Option, Playable without Timed Input, Save Anytime, Family Sharing","Indie, RPG, Strategy"
"Rollerdrome is a BAFTA award-winning third person action shooter that seamlessly blends high octane, visceral combat with fluid movement and tricking mechanics into one complementary and challenging whole, to create an original adrenaline-pumping shooter experience like no other.",https://shared.akamai.steamstatic.com/store_item_assets/steam/apps/1294420/header.jpg?t=1748361469,"Single-player, Steam Achievements, Full controller support, Steam Leaderboards, Family Sharing","Action, Indie, Sports"
"A romantic comedy visual novel centered around a girl named Mika Anderson, who gets entangled in the affairs of incubi.",https://shared.akamai.steamstatic.com/store_item_assets/steam/apps/367120/header.jpg?t=1754154989,"Single-player, Steam Achievements","Casual, Simulation"
"Journey from weekend warrior to racing legend &amp; experience the thrill &amp; emotion of authentic racing. Own, upgrade and personalise hundreds of cars, customise your driver, tailor every setting &amp; play the way you want in YOUR Ultimate Driver Journey.",https://shared.akamai.steamstatic.com/store_item_assets/steam/apps/958400/header.jpg?t=1756079735,"Single-player, Multi-player, PvP, Online PvP, Steam Achievements, Full controller support, VR Supported, Steam Trading Cards, Steam Cloud, Family Sharing",Racing
"A town flourished with woodworking and mining, &quot;Babel's Hill Top&quot;. A Ruggles family who contributed greatly to the development of this town several centuries ago. The tragedy that happened at the residence of them. In this residence where blood and hatred are ingrained, their nightmare begins.",https://shared.akamai.steamstatic.com/store_item_assets/steam/apps/1094030/header.jpg?t=1679572226,"Single-player, Steam Achievements","Action, Free To Play, Indie"
"Tom Clancy's Rainbow Six® Extraction is a tactical, co-op, PvE first-person shooter where you and your squad face an evolving alien threat. Teamwork, tactics, and flawless execution are key to your survival.",https://shared.akamai.steamstatic.com/store_item_assets/steam/apps/2379390/header.jpg?t=1765569459,"Single-player, Multi-player, Co-op, Online Co-op, Cross-Platform Multiplayer, Captions available, In-App Purchases, Partial Controller Support",Action
The beloved and critically acclaimed Ghostbusters video game is back! Strap on your proton pack once again and join the Ghostbusters on the adventure with the voice and likeness of the original crew as you battle to save New York!,https://shared.akamai.steamstatic.com/store_item_assets/steam/apps/1449280/header.jpg?t=1607351334,"Single-player, Steam Achievements, Full controller support, Family Sharing",Action
"Deadfall Adventures is an action-driven first-person shooter, spiced up with elements from action-adventure games. Become an adventurer, hunt for treasures, explore unknown regions of the world and rescue the damsel in distress from the clutches of enemies, both earthly and not-so-earthly.",https://shared.akamai.steamstatic.com/store_item_assets/steam/apps/231330/header.jpg?t=1744351771,"Single-player, Multi-player, Co-op, Steam Achievements, Steam Trading Cards, Partial Controller Support, Steam Cloud, Steam Leaderboards, Family Sharing","Action, Adventure"
"The Prince of Persia, a seasoned warrior, returns from the Island of Time to Babylon with his love, Kaileena. Instead of the peace that he longs for, he finds his homeland ravaged by war and the kingdom turned against him.",https://shared.akamai.steamstatic.com/store_item_assets/steam/apps/13530/header.jpg?t=1720535330,"Single-player, Partial Controller Support, Family Sharing","Action, Adventure"
"The gameplay in Toki Tori is a blend of two genres. While it looks like a platform game, it's a puzzle game at heart. To progress through the game, the player must pick up each egg in a level using a set number of tools.",https://shared.akamai.steamstatic.com/store_item_assets/steam/apps/38700/header.jpg?t=1596256691,"Single-player, Steam Achievements, Full controller support, Steam Cloud, Includes level editor, Family Sharing","Casual, Indie"
"&quot;This is some of the most fun I've had with a game so far this year, and it will go down as one of the best side-scrolling shooters of all time.&quot; - 9/10, Destructoid",https://shared.akamai.steamstatic.com/store_item_assets/steam/apps/214970/header.jpg?t=1770378956,"Single-player, Steam Achievements, Partial Controller Support, Steam Cloud, Remote Play on Phone, Remote Play on Tablet, Family Sharing","Action, Indie"
"Nex Machina is an intense arcade style twin-stick shooter from Housemarque. Taking hints from both Robotron and Smash TV, Nex Machina focuses on pure action, voxel destruction and competition in the distant, cablepunk themed future.",https://shared.akamai.steamstatic.com/store_item_assets/steam/apps/404540/header.jpg?t=1591699254,"Single-player, Multi-player, Co-op, Shared/Split Screen Co-op, Shared/Split Screen, Steam Achievements, Full controller support, Steam Trading Cards, Steam Cloud, Remote Play on Phone, Remote Play on Tablet, Remote Play on TV, Remote Play Together, Family Sharing","Action, Indie"
Assault Android Cactus is an intense arcade style twin stick shooter - pick from one of nine unique synthetic heroines and blast your way through overwhelming robots hordes to save the ship from its own workforce. Supports single player and local co-op game modes.,https://shared.akamai.steamstatic.com/store_item_assets/steam/apps/250110/header.jpg?t=1744898145,"Single-player, Multi-player, Co-op, Shared/Split Screen Co-op, Shared/Split Screen, Steam Achievements, Full controller support, Steam Trading Cards, Steam Cloud, Steam Leaderboards, Remote Play on Phone, Remote Play on Tablet, Remote Play on TV, Remote Play Together, Family Sharing","Action, Indie"
"Deathtrap is a Tower Defense game with strong action-RPG elements, a game of vicious tricks, killing machines, rotating blades and splattering blood.",https://shared.akamai.steamstatic.com/store_item_assets/steam/apps/310510/header.jpg?t=1618303780,"Single-player, Multi-player, Steam Achievements, Full controller support, Steam Trading Cards, Steam Workshop, Steam Cloud, Steam Leaderboards, Includes level editor, Family Sharing","Action, Adventure, Indie, RPG, Strategy"
"New Frontier is a pvp free-to-play online survival game set in an alternate reality wild west world. Work with your friends, Build your base, Fight hellish monsters and forge alliances with other players to conquer the land.",https://shared.akamai.steamstatic.com/store_item_assets/steam/apps/1104640/header.jpg?t=1653587991,"Multi-player, MMO, PvP, Online PvP, Co-op, Online Co-op, Steam Achievements, In-App Purchases, Family Sharing","Free To Play, Indie, Massively Multiplayer, RPG"
《秦殇》（Prince of Qin）是一款由目标软件公司开发的动作角色扮演游戏，该游戏已于2002年7月6日发行。本次进行重新上架，主旨是为了曾经深爱《秦殇》这款游戏的玩家在时隔20年后，能重新追忆当年的风采，特此针对现在的系统运行环境及显示器尺寸优化了分辨率，支持窗口化及1080P分辨率。,https://shared.akamai.steamstatic.com/store_item_assets/steam/apps/970500/header.jpg?t=1641899772,"Single-player, Family Sharing","Action, Adventure, RPG"
"Experience iconic golf courses like Pebble Beach, St Andrews and Wolf Creek in the most realistic free golf game, and connect with millions of players all over the world!",https://shared.akamai.steamstatic.com/store_item_assets/steam/apps/1182020/header.jpg?t=1774291489,"Single-player, Multi-player, PvP, Online PvP, Co-op, Online Co-op, Cross-Platform Multiplayer, In-App Purchases","Simulation, Sports, Free To Play, Early Access"
"&quot;Hunt bigger game on a bold new adventure with Magic 2015—Duels of the Planeswalkers! Hone your skills as you battle your way across the planes of the Multiverse. Beware though, Planeswalker. Your biggest danger is one of your own ... Garruk Wildspeaker, the greatest hunter known, is now hunting you!",https://shared.akamai.steamstatic.com/store_item_assets/steam/apps/255420/header.jpg?t=1606325446,"Single-player, Multi-player, Steam Achievements, Steam Trading Cards, Partial Controller Support, Stats, Family Sharing",Strategy
"The newest addition to the flagship WWE video game franchise will deliver fun, authentic and hard-hitting action, including returning fan-favourite features and game modes, new innovations and more!",https://shared.akamai.steamstatic.com/store_item_assets/steam/apps/385730/header.jpg?t=1572397400,"Single-player, Multi-player, Co-op, Shared/Split Screen, Full controller support, Remote Play on TV, Remote Play Together, Family Sharing","Simulation, Sports"
"Developed by a team of experienced modders from the Paradox forum, Darkest Hour is a stand-alone Hearts of Iron game. The game features a mixture of short and in-depth campaigns set across the darkest chapters of the 20th century. Play from the outbreak of the Great War up until the onset of the Cold War.",https://shared.akamai.steamstatic.com/store_item_assets/steam/apps/73170/header.jpg?t=1669648939,"Single-player, Multi-player, Family Sharing",Strategy
"FPV SkyDive is a free-to-play realistic drone racing and freestyle simulator. Feel the adrenaline of high speed first-person view drone racing in single-player or multi-player scenarios. The future is now, become an FPV pilot today!",https://shared.akamai.steamstatic.com/store_item_assets/steam/apps/1278060/header.jpg?t=1762421410,"Single-player, Multi-player, Co-op, LAN Co-op, Steam Achievements, Partial Controller Support","Adventure, Casual, Racing, Simulation, Sports, Free To Play"
Event[0] is a sci-fi narrative exploration game where you build a relationship with a lonely spaceship computer to get home to Earth.,https://shared.akamai.steamstatic.com/store_item_assets/steam/apps/470260/header.jpg?t=1774622671,"Single-player, Steam Achievements, Steam Trading Cards, Steam Cloud, Family Sharing","Adventure, Indie"
"When the truth is buried, go underground. Step into this new take on text-based adventure from the award-winning team behind Thomas Was Alone and Volume. A short story that hands you the fate of the world above, as a detective looking for answers on the Subsurface Circular.",https://shared.akamai.steamstatic.com/store_item_assets/steam/apps/676820/header.jpg?t=1759230221,"Single-player, Steam Achievements, Steam Cloud, Commentary available, Family Sharing","Adventure, Casual, Indie"
"Take the loot, pirates! Bounty Rush is a 4 vs 4 multiplayer team action game. Work with your team to capture the other teams' berries!",https://shared.akamai.steamstatic.com/store_item_assets/steam/apps/2918150/header.jpg?t=1774508259,"Single-player, Multi-player, PvP, Online PvP, Co-op, Online Co-op, Steam Achievements, Full controller support, In-App Purchases","Action, Free To Play"
Lead a party of aspiring heroes through a beautifully hand-drawn world and intense battles using only your wits and a handful of cards. Take on whatever threat comes your way by crafting your own deck choosing from over 100 unique punch-cards!,https://shared.akamai.steamstatic.com/store_item_assets/steam/apps/804010/header.jpg?t=1726132201,"Single-player, Steam Achievements, Full controller support, Steam Trading Cards, Steam Cloud, Family Sharing","Adventure, RPG"
"Do you like running? How about gunning? What if special abilities are thrown into the mix? Upgradable weapons? Let's say there’re dozens of on-screen enemies to unleash this firepower on, and as your reward for dispatching them you get experience and gold to collect that can be used for character customization and new equipment--all the...",https://shared.akamai.steamstatic.com/store_item_assets/steam/apps/227480/header.jpg?t=1679178430,"Single-player, Multi-player, Co-op, Steam Achievements, Steam Trading Cards, Partial Controller Support, Family Sharing",Action
Navigate the beauty and hazards of the solar system while riding a wave of light through 100+ levels in this innovative action-puzzle game!,https://shared.akamai.steamstatic.com/store_item_assets/steam/apps/204180/header.jpg?t=1665958041,"Single-player, Steam Achievements, Steam Trading Cards, Steam Cloud, Stats, Steam Leaderboards, Family Sharing","Adventure, Indie, Strategy"
"Tempest is a Pirate Open World Action RPG where you rove the seas across three continents filled with dozens of colonies and forts, hundreds of quests and countless ships to plunder. Customize your ship, trade, challenge fellow pirates and face mythical monsters such as the Kraken and Leviathan!",https://shared.akamai.steamstatic.com/store_item_assets/steam/apps/418180/header.jpg?t=1768395368,"Single-player, Multi-player, Co-op, Steam Achievements, Full controller support, Steam Trading Cards, Steam Cloud, Remote Play on TV, Family Sharing","Action, Indie, RPG"
"This open-world action thriller takes you through the seedy streets of Paris as you seek to undermine the German authority and lead a rebellion. Fight across rooftops and through dangerous alleys, and operate a wide variety of vehicles as you navigate your terrain.",https://shared.akamai.steamstatic.com/store_item_assets/steam/apps/24880/header.jpg?t=1718287884,"Single-player, Family Sharing","Action, Adventure"
"Battle against hordes of enemies, conquer Boss encounters, and explore various character and skill combinations in this time-based auto-attacking Roguelite in your quest to become stronger and defeat the most menacing of creatures that lay in wait at the end of each run.",https://shared.akamai.steamstatic.com/store_item_assets/steam/apps/1929870/header.jpg?t=1758053274,"Single-player, Steam Achievements, Partial Controller Support, Family Sharing","Action, Indie"
"Trials Evolution: Gold Edition marks the Trials franchise’s triumphant return to the PC gaming platform. RedLynx’s signature franchise, the Trials series first made its mark in gaming with the 2008 release of Trials 2 SE for the PC.",https://shared.akamai.steamstatic.com/store_item_assets/steam/apps/220160/header.jpg?t=1747656959,"Single-player, Multi-player, Steam Achievements, Partial Controller Support","Action, Racing"
DISTRUST is an isometric survival adventure with procedural generation on an Arctic research station lost in the endless dark of a polar night. A story-rich fiction with multiple endings that suits both singleplayer fans and co-op enthusiasts.,https://shared.akamai.steamstatic.com/store_item_assets/steam/apps/635200/header.jpg?t=1748493906,"Single-player, Steam Achievements, Steam Trading Cards, Partial Controller Support, Steam Cloud, Family Sharing","Adventure, Indie, Strategy"
"Succeeding in Tharsis requires you to make the best of what you have, even if it happens to be a pair of snake eyes. Certain factors may be outside of your control, but that doesn’t mean they can’t be overcome. Tharsis is not a game about facing the odds. It’s a game about changing them.",https://shared.akamai.steamstatic.com/store_item_assets/steam/apps/323060/header.jpg?t=1702627319,"Single-player, Steam Achievements, Steam Trading Cards, Steam Cloud, Steam Leaderboards, Family Sharing","Casual, Indie, RPG, Strategy"
"Screencheat is a ridiculous competitive split-screen first-person shooter where everyone is invisible, so players are forced to look at each other’s screens to win. Supporting both local and online multiplayer, combat in Screencheat is fast and furious with a wide variety of one-hit kill weapons.",https://shared.akamai.steamstatic.com/store_item_assets/steam/apps/301970/header.jpg?t=1747870310,"Single-player, Multi-player, PvP, Online PvP, Shared/Split Screen PvP, Shared/Split Screen, Steam Achievements, Full controller support, Steam Trading Cards, Color Alternatives, Custom Volume Controls, Playable without Timed Input, Stereo Sound, Steam Cloud, Remote Play on TV, Remote Play Together, Family Sharing","Action, Indie"
Screeps: World is an open source MMO strategy sandbox game for programming enthusiasts. You control your colony by writing JavaScript code that operates 24/7 in the huge persistent online open world.,https://shared.akamai.steamstatic.com/store_item_assets/steam/apps/464350/d1efe845a1ba21f781f8dffd96a1242d4db0115d/header.jpg?t=1773913828,"Single-player, Multi-player, MMO, PvP, Online PvP, LAN PvP, Cross-Platform Multiplayer, Steam Trading Cards, Steam Workshop, Stats, Steam Leaderboards","Indie, Massively Multiplayer, Simulation, Strategy"
"Quantum League is a revolutionary Time-Paradox Shooter: a competitive online FPS where you are battling within a time loop, tactically teaming up with your past and future selves in mind-blowing 1v1 and 2v2 matches.",https://shared.akamai.steamstatic.com/store_item_assets/steam/apps/651150/header.jpg?t=1695300749,"Multi-player, PvP, Online PvP, Steam Trading Cards, Partial Controller Support, Family Sharing","Action, Indie, Sports, Strategy"
"The Adventure Pals is an epic adventure platformer fueled by imagination, friendship, and the dark side of hot dogs. Your dad has been dadnapped and you, your pet rock, and a tongue-helicoptering giraffe must fight your way through levels filled with platforming, bizarre enemies, and big bosses to save the world!",https://shared.akamai.steamstatic.com/store_item_assets/steam/apps/396710/header.jpg?t=1726581654,"Single-player, Multi-player, Co-op, Shared/Split Screen Co-op, Shared/Split Screen, Steam Achievements, Full controller support, Steam Trading Cards, Remote Play on Phone, Remote Play on Tablet, Remote Play on TV, Remote Play Together, Family Sharing","Action, Adventure, Indie, RPG"
"You are Yomi, an ancient fox spirit. Your dungeon has been stolen from you while you have been sealed away in a deep sleep. Capture monster girls, collect loot, explore the dungeon's depths and reclaim what is yours in this first-person RPG dungeon crawler.",https://shared.akamai.steamstatic.com/store_item_assets/steam/apps/407330/header.jpg?t=1667482285,"Single-player, Steam Achievements, Full controller support, Steam Trading Cards, Family Sharing","Adventure, Indie, RPG"
"Whispers of a Machine is a Sci-Fi Nordic Noir that tells the story of Vera, a cybernetically augmented detective in a post-AI world, who investigates a string of murders and unravels a dark conflict over forbidden technology.",https://shared.akamai.steamstatic.com/store_item_assets/steam/apps/631570/header.jpg?t=1726577495,"Single-player, Steam Achievements, Steam Cloud, Family Sharing",Adventure
Craft your arsenal to avenge your fallen comrades and save the world from the fearsome forces of CLAW!,https://shared.akamai.steamstatic.com/store_item_assets/steam/apps/218820/header.jpg?t=1727901831,"Single-player, Multi-player, Co-op, Shared/Split Screen, Cross-Platform Multiplayer, Steam Achievements, Full controller support, Steam Trading Cards, Steam Cloud, Remote Play on TV, Remote Play Together, Family Sharing","Action, Adventure, Indie, RPG"
"Fly through danger filled procedurally generated tunnels, avoiding thousands of enemies, on this throwback to the golden age of arcade games.",https://shared.akamai.steamstatic.com/store_item_assets/steam/apps/562360/header.jpg?t=1762262867,"Single-player, Steam Achievements, Full controller support, Steam Trading Cards, Steam Cloud, Steam Leaderboards, Family Sharing","Action, Casual, Indie"
"Defenders 2, - an exciting hybrid of Tower Defense and CCG, - is now available on Steam! Challenge endless hordes of monsters: build an impassable defense on their path and protect your mines. Collect all the unique towers and prove that even a tornado is not an obstacle for you.",https://shared.akamai.steamstatic.com/store_item_assets/steam/apps/429540/header.jpg?t=1580816987,"Single-player, Multi-player, MMO, Cross-Platform Multiplayer, Steam Trading Cards, In-App Purchases","Free To Play, Massively Multiplayer, Strategy"
"War covers the southern islands until it finally reaches the idyllic isle of Feshyr. You take on the role as the new nameless hero after your village has been pillaged and destroyed by paladins of the king. Seeking revenge, you soon realize that this cowardly attack did not just happen on a reckless mercenary`s whim.",https://shared.akamai.steamstatic.com/store_item_assets/steam/apps/39690/header.jpg?t=1662034747,"Single-player, Family Sharing",RPG
"Combining action and strategy in a unique way, Sang-Froid: Tales of Werewolves transports you into an epic folktale co-written with best-selling Canadian author Bryan Perro (Amos Daragon, Wariwulf), in which two feuding brothers will have to put aside their differences to save their sister, who is pursued by the Devil himself!",https://shared.akamai.steamstatic.com/store_item_assets/steam/apps/227220/header.jpg?t=1726588248,"Single-player, Steam Achievements, Steam Trading Cards","Action, Adventure, Indie, RPG, Strategy"
"Elaborate jigsaw puzzle: 100 beautiful pictures, 100 custom difficulty, 100 game achievements.",https://shared.akamai.steamstatic.com/store_item_assets/steam/apps/939620/header.jpg?t=1601777872,"Single-player, Steam Achievements, Steam Cloud, Steam Leaderboards, Family Sharing","Casual, Indie, Simulation"
Play the first game where the Mage is a total badass!,https://shared.akamai.steamstatic.com/store_item_assets/steam/apps/261760/header.jpg?t=1572521514,"Single-player, Steam Achievements, Full controller support, Steam Trading Cards, Steam Cloud, Remote Play on TV, Family Sharing","Action, Indie, RPG"
Blade Assault is a 2D action rogue-lite platformer with beautiful pixel art set in a desolate sci-fi world. Fight against the corrupt military of Esperanza as part of the resistance force of the Undercity. Bring the corrupt to justice by becoming stronger and fighting alongside your trusty comrades.,https://shared.akamai.steamstatic.com/store_item_assets/steam/apps/1367300/header.jpg?t=1723790386,"Single-player, Steam Achievements, Steam Trading Cards, Partial Controller Support, Steam Cloud, Family Sharing","Action, Indie"
Operation Flashpoint: Dragon Rising is a game about a fictitious conflict on one of the Sakhalin islands.,https://shared.akamai.steamstatic.com/store_item_assets/steam/apps/12830/header.jpg?t=1741975283,"Single-player, Partial Controller Support, Family Sharing",Action
"There is an unusual cabin deep in the woods. It had served as a laboratory and a dwelling for three generations of Lodgers.But as of late the latest Lodger has been noticing weird changes in familiar surroundings; things are missing, noises and rattle heard. Something odd is coming out of the woods.",https://shared.akamai.steamstatic.com/store_item_assets/steam/apps/250380/header.jpg?t=1669134410,"Single-player, Steam Achievements, Full controller support, Steam Trading Cards, Family Sharing","Adventure, Casual"
"The Skies is a unique combination of post-apocalyptic MMORPG and FPS with a non-linear storyline, in which you follow your own path or join other players to conquer the wasteland.",https://shared.akamai.steamstatic.com/store_item_assets/steam/apps/337950/header.jpg?t=1607048255,"Multi-player, MMO, Steam Achievements, In-App Purchases, Steam Leaderboards, Family Sharing","Free To Play, Massively Multiplayer, RPG, Early Access"
