short_description,header_image,categories,genres
"Meet Yoku, the pint-sized postman protagonist of Yoku's Island Express! Use a unique blend of pinball mechanics, platforming and open world exploration to unlock the secrets of Mokumana Island, help the locals, awaken ancient deities and much more in this amazing new tropical adventure!",https://shared.akamai.steamstatic.com/store_item_assets/steam/apps/334940/header.jpg?t=1763040310,"Single-player, Steam Achievements, Full controller support, Steam Trading Cards, Steam Cloud, Remote Play on TV, Family Sharing","Adventure, Indie"
"Greetings Enforcer, and thank you for enlisting in the Hypnospace Patrol Department! As the world falls into its slumber, Hypnospace becomes a bustling global village. These virtual streets aren't going to police themselves!",https://shared.akamai.steamstatic.com/store_item_assets/steam/apps/844590/header.jpg?t=1755257643,"Single-player, Steam Achievements, Steam Trading Cards, Partial Controller Support, Steam Cloud, Family Sharing",Simulation
"Transform the world of Hob! A new action-adventure from Runic Games, the award-winning studio behind Torchlight I and II. It's your chance. Make it home.",https://shared.akamai.steamstatic.com/store_item_assets/steam/apps/404680/header.jpg?t=1729011187,"Single-player, Steam Achievements, Full controller support, Steam Cloud, Remote Play on TV, Family Sharing","Action, Adventure, Indie"
"CONNECT MORE THAN CITIES! Set off with your friends and family to re(discover) Ticket to Ride: Classic Edition, the classic boardgame. In this railway adventure, you’ll need to be the quickest to link up your cities and reach your destinations.",https://shared.akamai.steamstatic.com/store_item_assets/steam/apps/108200/header.jpg?t=1696352833,"Single-player, Multi-player, PvP, Online PvP, LAN PvP, Shared/Split Screen PvP, Shared/Split Screen, Cross-Platform Multiplayer, Steam Achievements, Remote Play on Phone, Remote Play on Tablet, Remote Play Together, Family Sharing","Casual, Indie, Strategy"
"Figment is an action-adventure game that invites you to explore a unique surreal universe filled with music, humor and multi layered narrative. Join Dusty and his ever-optimistic friend, Piper, on an adventure through the different sides of the mind seeking to restore the courage that's been lost.",https://shared.akamai.steamstatic.com/store_item_assets/steam/apps/493540/header.jpg?t=1729500541,"Single-player, Steam Achievements, Full controller support, Steam Trading Cards, Steam Cloud, Remote Play on TV, Family Sharing","Action, Adventure, Casual, Indie"
"Burnout Paradise Remastered provides the ultimate driving playground for you and your friends to play online. This remaster includes all add-ons from the Year of Paradise, including the Big Surf Island update, meticulously recreated and ready to wreck in 4K.",https://shared.akamai.steamstatic.com/store_item_assets/steam/apps/1238080/header.jpg?t=1625518920,"Single-player, Multi-player, PvP, Online PvP, Co-op, Online Co-op, Steam Achievements, Full controller support, Steam Trading Cards","Action, Adventure, Racing"
"A land of discovery stretches out before you. Explore the beautiful, rugged world of RiME. Armed with your wits and a will to overcome—and the guidance of a helpful fox—you must explore the enigmatic island, reach the tower's peak, and unlock its closely guarded secrets.",https://shared.akamai.steamstatic.com/store_item_assets/steam/apps/493200/header.jpg?t=1667232008,"Single-player, Steam Achievements, Full controller support, Steam Cloud, Family Sharing",Adventure
"My Dream Setup is a simulation game about building the room you've always dreamed of. A huge selection of furniture, computers and their accessories, posters, pictures, plants, and other interior details await you. Try all of them and create your dream setup.",https://shared.akamai.steamstatic.com/store_item_assets/steam/apps/2200780/header.jpg?t=1774698315,"Single-player, Steam Achievements, Steam Trading Cards, Steam Workshop, Family Sharing","Casual, Indie, Simulation"
Best pixel art editor. Simple. Fast. Portable.,https://shared.akamai.steamstatic.com/store_item_assets/steam/apps/1204050/header.jpg?t=1749392931,In-App Purchases,"Animation & Modeling, Design & Illustration, Photo Editing, Game Development"
"Back to the Dawn is a story-rich RPG set in a high-security prison ruled by factions and buried secrets. Investigate two conspiracies from the inside, gather evidence, and outsmart a system designed to silence you. Make friends (or foes) with fellow inmates and with their help, break out of prison.",https://shared.akamai.steamstatic.com/store_item_assets/steam/apps/1735700/4ec07b7ab8091feb176f7ad58b833c52524ffe11/header.jpg?t=1774948075,"Single-player, Steam Achievements, Full controller support, Steam Trading Cards, Color Alternatives, Adjustable Difficulty, Stereo Sound, Steam Cloud, Family Sharing","Adventure, Indie, RPG, Simulation, Strategy"
"In Reus, you control powerful giants to shape the planet to your will. You can create mountains, oceans, forests and more. Enrich your planet with plants, minerals and animal life. There is only one thing on the planet that you do not control: mankind, with all their virtues and and all their vices.",https://shared.akamai.steamstatic.com/store_item_assets/steam/apps/222730/header.jpg?t=1730204355,"Single-player, Steam Achievements, Steam Trading Cards, Family Sharing","Indie, Simulation, Strategy"
"In a world where robots have replaced all human jobs, step into the &quot;Job Simulator&quot; to learn what it was like 'to job'.",https://shared.akamai.steamstatic.com/store_item_assets/steam/apps/448280/header.jpg?t=1710217876,"Single-player, Steam Achievements, Tracked Controller Support, VR Only, Steam Trading Cards, Captions available, VR Support, SteamVR Collectibles, Family Sharing","Action, Casual, Indie, Simulation"
"The world has been abandoned by its gods and is scarred from the rampage of the Titans. Humanity is struggling to regain strength. You, however, have more pressing concerns: your own life has been shattered and you must set off to reclaim what is lost amidst the darkness spreading throughout the world.",https://shared.akamai.steamstatic.com/store_item_assets/steam/apps/249230/header.jpg?t=1601972818,"Single-player, Steam Achievements, Steam Trading Cards, Captions available, Partial Controller Support, Steam Cloud, Family Sharing",RPG
Real Time Strategy with a high degree of realism. The game is based on a true story.,https://shared.akamai.steamstatic.com/store_item_assets/steam/apps/485980/header.jpg?t=1774532761,"Single-player, Steam Achievements, Steam Trading Cards, Family Sharing","Indie, Strategy"
"Meteor 60 seconds! is a simple, fun, comic-like action game that simulates your life if there were a meteor heading towards Earth and you had 60 seconds to live. Do anything you want to do with your last 60 seconds, even if it's illegal! What about planting an apple tree?",https://shared.akamai.steamstatic.com/store_item_assets/steam/apps/788770/header.jpg?t=1689035903,Single-player,"Action, Casual, Free To Play, Indie, Simulation"
"Ghost of a Tale is an action-RPG game in which you play as Tilo, a mouse and minstrel thrown into a perilous adventure. Through stealth and cunning you’ll be able to explore the secrets of Dwindling Heights Keep and navigate its dangers.",https://shared.akamai.steamstatic.com/store_item_assets/steam/apps/417290/header.jpg?t=1667033370,"Single-player, Steam Achievements, Full controller support, Steam Cloud, Remote Play on TV, Family Sharing","Action, Adventure, Indie, RPG"
Shuffle your cards and ready your dice - Card Hunter is a fresh new card gaming spin on classic tabletop RPGs. Battle your way through a massive campaign solo or with friends and compete with other players in ranked play and tournaments.,https://shared.akamai.steamstatic.com/store_item_assets/steam/apps/293260/header.jpg?t=1724143840,"Single-player, Multi-player, Co-op, Cross-Platform Multiplayer, Steam Achievements, Steam Trading Cards, Captions available, Includes level editor","RPG, Strategy, Free To Play"
"Run, jump and slide to the rhythm of your own music library! In Melody's Escape, advanced audio detection algorithms transcribe the energy that you feel when listening to music into a synchronized gameplay experience, with a captivating and dynamic obstacle course.",https://shared.akamai.steamstatic.com/store_item_assets/steam/apps/270210/header.jpg?t=1669064914,"Single-player, Steam Achievements, Full controller support, Steam Trading Cards, Steam Workshop, Family Sharing",Indie
"KOF 2002 UM is the 2nd title in the UM Series and a fully upgraded ver. of KOF 2002, a masterpiece of the KOF Series deserving its place of honor alongside KOF ’98. Based on THE NESTS CHRONICLES, 2002 UM includes the most characters of any title in the KOF Series, and fighting game history!",https://shared.akamai.steamstatic.com/store_item_assets/steam/apps/222440/header.jpg?t=1775107293,"Single-player, Multi-player, Co-op, Shared/Split Screen Co-op, Steam Achievements, Steam Trading Cards, Partial Controller Support, Steam Leaderboards, Remote Play Together, Family Sharing",Action
"Become a crew member of an Interdimensional Express Train! Discover a new world full of mysterious creatures, enemies and places. Upgrade and customize your train, gather new materials and build better weapons. Play solo or online сo-op with up to 4 people.",https://shared.akamai.steamstatic.com/store_item_assets/steam/apps/1159690/c37f0d9c54c79a8267602beecba728872753f847/header.jpg?t=1771524180,"Single-player, Multi-player, Co-op, Online Co-op, Cross-Platform Multiplayer, Steam Achievements, Steam Trading Cards, Partial Controller Support, Steam Cloud, Family Sharing","Action, Adventure, Indie, RPG, Simulation"
"Command and customize your own capital ships. Take down opponents in thundering, team-based combat. Dreadnought is a free-to-play shooter that puts you at the center of spaceship battles on a colossal scale.",https://shared.akamai.steamstatic.com/store_item_assets/steam/apps/835860/header.jpg?t=1711147342,"Multi-player, MMO, PvP, Online PvP, Co-op, Online Co-op, In-App Purchases, Family Sharing","Action, Massively Multiplayer"
"KO the gods in the world’s only 3rd-person platform fighter! Become a small-but-mighty god of myth, brawl in all three dimensions, and knock your friends off the map to reign supreme.",https://shared.akamai.steamstatic.com/store_item_assets/steam/apps/1294660/header.jpg?t=1739811739,"Multi-player, PvP, Online PvP, Cross-Platform Multiplayer, Steam Achievements, Full controller support, In-App Purchases, Family Sharing",Action
Bear and Breakfast is a laid-back management adventure game where you build and run a bed and breakfast...but you’re a bear.,https://shared.akamai.steamstatic.com/store_item_assets/steam/apps/1136370/header.jpg?t=1726580385,"Single-player, Steam Achievements, Full controller support, Steam Trading Cards, Steam Cloud, Family Sharing","Adventure, Casual, RPG, Simulation"
"It's finally here! The survival action game that pits the strong against the weak is finally on PC! Experience all the heart-thumping action with a silky-smooth frame rate and ultra high resolution. How you make the best of the weapons, armor, and items at your disposal will determine your fate in the ever-changing &quot;Tower of Barbs!",https://shared.akamai.steamstatic.com/store_item_assets/steam/apps/794600/header.jpg?t=1772655611,"Single-player, Steam Achievements, Captions available, In-App Purchases, Partial Controller Support","Action, Free To Play"
Begin a journey in the beautiful world! Build your own town anywhere and explore the myterious lands anytime. Nothing is impossible in the open world: Be a legendary warrior and 5-star chef at the same time!,https://shared.akamai.steamstatic.com/store_item_assets/steam/apps/361800/header.jpg?t=1612271843,"Multi-player, MMO, PvP, Online PvP, Co-op, Online Co-op, Family Sharing","Indie, Massively Multiplayer, RPG"
"Become a ragdoll and create your own environments in Sandbox Mode, explore worlds created by others, or just flop around your destructible sets! Fun with Ragdolls®: The Game lets you enjoy everything you love about ragdolls!",https://shared.akamai.steamstatic.com/store_item_assets/steam/apps/1142500/header.jpg?t=1766094629,"Single-player, Includes level editor, Family Sharing","Action, Indie, Simulation"
"Niche - a genetics survival game is a turn-based strategy game combined with simulation and roguelike elements. Shape your own species of animals based on real genetics. Keep your species alive against all odds, such as predators, climate change and spreading sickness.",https://shared.akamai.steamstatic.com/store_item_assets/steam/apps/440650/header.jpg?t=1750254505,"Single-player, Steam Achievements, Steam Trading Cards, Camera Comfort, Custom Volume Controls, Adjustable Difficulty, Playable without Timed Input, Save Anytime, Stereo Sound, Steam Cloud, Family Sharing","Indie, Simulation, Strategy"
"We are the world’s premier motorsports racing game. An iRacing membership provides entry into the newest form of motorsport: internet racing. Internet racing is a fun, easy, and inexpensive way for race fan and gamers alike to enjoy the thrill of the racetrack from the comfort of their home.",https://shared.akamai.steamstatic.com/store_item_assets/steam/apps/266410/header.jpg?t=1775586194,"Single-player, Multi-player, MMO, PvP, Online PvP, VR Support, Partial Controller Support, Family Sharing","Massively Multiplayer, Racing, Simulation, Sports"
"Jack Nelson, a 24-year-old fire lookout, transferred to a new outpost. As he settled into his new home, he couldn't shake the feeling that something was off, little did he know what was transpiring down in Ironbark State Park.",https://shared.akamai.steamstatic.com/store_item_assets/steam/apps/2506160/header.jpg?t=1761626826,"Single-player, Steam Achievements, Family Sharing","Adventure, Casual, Indie"
"Originally released by LucasArts in 1993 as a sequel to Ron Gilbert’s ground breaking Maniac Mansion, Day of the Tentacle is back in a remastered edition that features all new hand-drawn, high resolution artwork, with remastered audio, music and sound effects.",https://shared.akamai.steamstatic.com/store_item_assets/steam/apps/388210/header.jpg?t=1731602439,"Single-player, Steam Achievements, Full controller support, Steam Trading Cards, Steam Cloud, Commentary available, Remote Play on Phone, Remote Play on Tablet, Remote Play on TV, Family Sharing",Adventure
"Death's Gambit: Afterlife is a challenging 2D action platformer with deep RPG elements. As an agent of Death bound to his service, unravel the mystery of Siradon and discover the true price of immortality.",https://shared.akamai.steamstatic.com/store_item_assets/steam/apps/356650/header.jpg?t=1754951948,"Single-player, Steam Achievements, Full controller support, Steam Trading Cards, Remote Play on TV, Family Sharing","Action, Adventure, Indie, RPG"
"Build your dream railroad across a huge open world! You can build tracks and stations, drive detailed locomotives, and transport goods to earn money and experience. Play exciting Online Multiplayer sessions with your friends or create your very own sandbox!",https://shared.akamai.steamstatic.com/store_item_assets/steam/apps/1696810/header.jpg?t=1754385377,"Single-player, Multi-player, Co-op, Online Co-op, Family Sharing","Indie, Simulation"
"Choose between different factions, with their own set of expendable soldiers, mechas, and weapons. Protect your brain, mine gold, and destroy the enemy cortex in his bunker complex!",https://shared.akamai.steamstatic.com/store_item_assets/steam/apps/209670/header.jpg?t=1572320618,"Single-player, Multi-player, Shared/Split Screen, Steam Achievements, Full controller support, Steam Trading Cards, Steam Workshop, Steam Cloud, Includes level editor, Remote Play Together, Family Sharing","Action, Indie, Strategy"
"Xenonauts is a strategy game in which you control a multi-national military organisation defending a Cold War-era Earth from alien invasion, using small squads of persistent soldiers to eliminate the extraterrestrials and recover their technology in turn-based ground combat.",https://shared.akamai.steamstatic.com/store_item_assets/steam/apps/223830/header.jpg?t=1673967760,"Single-player, Steam Trading Cards, Family Sharing","Indie, Simulation, Strategy"
"Ten years on from Worms™ Armageddon and the turn-based comic mayhem continues in Worms™ Reloaded, an all-new edition available for PC through Steam.",https://shared.akamai.steamstatic.com/store_item_assets/steam/apps/22600/header.jpg?t=1596807362,"Single-player, Multi-player, PvP, Shared/Split Screen PvP, Steam Achievements, Partial Controller Support, Steam Cloud, Stats, Steam Leaderboards, Remote Play Together, Family Sharing",Strategy
"Orcs Must Die! Unchained takes the award-winning Orcs Must Die! action tower defense game to a whole new level with team-based gameplay! Bust skulls with your best pals in PvE co-op Survival, or put your teamwork to the real test in Sabotage Mode!",https://shared.akamai.steamstatic.com/store_item_assets/steam/apps/427270/header.jpg?t=1623173206,"Single-player, Multi-player, Co-op, Steam Achievements, In-App Purchases, Partial Controller Support, Family Sharing","Action, Free To Play, Strategy"
"&quot;The ultimate depiction of the Three Kingdom. A heroic drama of a gathering of Legends. &quot;With this as the concept behind Romance of the Three Kingdoms 13, we have compiled an experience that will immerse you even deeper into the world of the Three Kingdoms, with &quot;human drama,&quot; seen through the interactions of the...",https://shared.akamai.steamstatic.com/store_item_assets/steam/apps/363150/header.jpg?t=1760589032,"Single-player, Steam Cloud, Family Sharing",Simulation
"Blameless is a mysterious first-person adventure with primary focus on puzzle solving and short story. The player will appear in a role of an architect trying to investigate strange happenings, after discovering evidence of an act of violence.",https://shared.akamai.steamstatic.com/store_item_assets/steam/apps/530330/header.jpg?t=1567232080,"Single-player, Steam Achievements, Captions available, Steam Cloud","Adventure, Free To Play, Indie"
Fight the greatest battles in the STAR WARS universe any way you want to. The choice is yours.,https://shared.akamai.steamstatic.com/store_item_assets/steam/apps/1058020/header.jpg?t=1741728874,"Single-player, Multi-player, PvP, Online PvP, Cross-Platform Multiplayer, Steam Cloud, Family Sharing",Action
"In Anno 2205™, you join humankind‘s next step into the future with the promise to build a better tomorrow. You conquer Earth, establishing rich, bustling cities and grand industrial complexes, but to secure the prosperity of your people, you must travel into space.",https://shared.akamai.steamstatic.com/store_item_assets/steam/apps/375910/header.jpg?t=1692034365,"Single-player, Steam Achievements, Steam Trading Cards","Simulation, Strategy"
"Take over the control of one of the mighty nations during the times of World War 2 in this persisting long-term strategy game. Conquer provinces, forge alliances and build up your economy in real-time. Research top secret weapons of World War 2 and become the one true superpower!",https://shared.akamai.steamstatic.com/store_item_assets/steam/apps/672680/692332dc6ec975b27c7540316543db8d66b6f408/header.jpg?t=1745932955,"Multi-player, MMO, PvP, Online PvP, Co-op, Online Co-op, Cross-Platform Multiplayer, Steam Achievements, Steam Trading Cards, In-App Purchases, Stats","Massively Multiplayer, Simulation, Strategy, Free To Play"
The unstoppable fluid enemy has returned and destroyed every world in its path! Defend against Creeper as it floods across the 3D terrain in this real time strategy game where the enemy is a fluid.,https://shared.akamai.steamstatic.com/store_item_assets/steam/apps/848480/header.jpg?t=1688931316,"Single-player, Multi-player, Co-op, Online Co-op, LAN Co-op, Steam Achievements, Steam Cloud, Stats, Includes level editor, Family Sharing","Action, Casual, Indie, Simulation, Strategy"
"Amateur or experienced FPV pilot, learn or improve your skills on Uncrashed,the new ultra realistic FPV simulator. Simulate your own FPV drone with settings based on real values and you will have the same feeling as a real flight without the risk of breaking your drone !",https://shared.akamai.steamstatic.com/store_item_assets/steam/apps/1682970/header.jpg?t=1775125881,"Single-player, Multi-player, PvP, Online PvP, Steam Workshop, Partial Controller Support, Steam Leaderboards, Includes level editor, Family Sharing","Action, Indie, Racing, Simulation, Sports"
"Aiko's Choice is the anticipated standalone expansion to the acclaimed stealth strategy game Shadow Tactics. Set in Edo Japan, you take control of the skillful kunoichi adept Aiko and her deadly assassin friends to hunt down the ghosts of her past.",https://shared.akamai.steamstatic.com/store_item_assets/steam/apps/1579380/header.jpg?t=1770912338,"Single-player, Steam Achievements, Full controller support, Steam Trading Cards, Steam Cloud, Remote Play on TV, Family Sharing","Indie, Strategy"
"Create unique crosshairs for any game! Choose from many built-in crosshairs or download from the Steam Workshop, and create your own. User-friendly interface, anti-cheat compatible. Customize your gaming experience!",https://shared.akamai.steamstatic.com/store_item_assets/steam/apps/1477830/header.jpg?t=1756228884,"Steam Achievements, Steam Workshop","Action, Education, Software Training, Utilities, Video Production"
The Ancient Gods – Part One is the first campaign expansion for the critically acclaimed DOOM Eternal.,https://shared.akamai.steamstatic.com/store_item_assets/steam/apps/1098292/header.jpg?t=1691692994,"Single-player, Steam Achievements, Steam Trading Cards, Partial Controller Support, Steam Cloud, Family Sharing",Action
"Serious Sam: Siberian Mayhem is a new stand-alone expansion to the world of the classic FPS series. Join the fight against Notorious Mental on a journey through the wild lands of Russia, and find your way through this lost chapter of Sam Stone's adventures.",https://shared.akamai.steamstatic.com/store_item_assets/steam/apps/1792250/header.jpg?t=1710764267,"Single-player, Multi-player, Co-op, Online Co-op, Steam Achievements, Full controller support, Steam Trading Cards, Steam Workshop, Steam Cloud, Includes level editor, Family Sharing","Action, Adventure"
The STAR WARS™ Battlefront™ Ultimate Edition includes the STAR WARS™ Battlefront™ Deluxe Edition as well as the STAR WARS™ Battlefront™ Season Pass.,https://shared.akamai.steamstatic.com/store_item_assets/steam/apps/1237980/header.jpg?t=1614940962,"Single-player, Multi-player, PvP, Online PvP, Steam Achievements, Full controller support, Steam Trading Cards","Action, Adventure, Strategy"
"Mega Man is back! The newest entry in this iconic series blends classic, challenging 2D platforming action with a fresh new visual style. The new Double Gear system boosts Mega Man's speed and power for a new twist to the satisfying gameplay the series is known for.",https://shared.akamai.steamstatic.com/store_item_assets/steam/apps/742300/header.jpg?t=1770613022,"Single-player, Steam Achievements, Full controller support, Steam Trading Cards, Steam Cloud, Steam Leaderboards, Family Sharing",Action
"In the second game of the series, competition has increased and now everyone wants to be a streamer. Are you ready to stream until your cpu burns out?",https://shared.akamai.steamstatic.com/store_item_assets/steam/apps/2890830/header.jpg?t=1770300068,"Single-player, Steam Achievements, Family Sharing","Indie, Simulation"
"Forgive Me Father is a dark retro horror FPS set in a comic book style world inspired by the novels of H.P. Lovecraft. As the only one left with full senses, you begin a journey in search of answers and relief. How long can you last?",https://shared.akamai.steamstatic.com/store_item_assets/steam/apps/1590910/header.jpg?t=1771336556,"Single-player, Steam Achievements, Full controller support, Steam Trading Cards, Steam Cloud, Family Sharing","Action, Indie"
"** Please note: a remastered and improved edition of this game is now available in Zombie Army Trilogy.**Featuring a co-op campaign for 1 to 4 players, Nazi Zombie Army is a horrifying new stand-alone expansion of the award-winning Sniper Elite series.",https://shared.akamai.steamstatic.com/store_item_assets/steam/apps/227100/header.jpg?t=1589878229,"Single-player, Multi-player, Co-op, Steam Achievements, Steam Trading Cards, Partial Controller Support, Steam Cloud, Valve Anti-Cheat enabled, Steam Leaderboards, Family Sharing",Action
"Dragons: they have been hunted, they have been slain, but now the hour to strike back has come.",https://shared.akamai.steamstatic.com/store_item_assets/steam/apps/219780/header.jpg?t=1765504781,"Single-player, Family Sharing",RPG
You are an up and coming summoner and a lover of monster girls. Earn money to gather up summoning materialsand summon monster girls!,https://shared.akamai.steamstatic.com/store_item_assets/steam/apps/533540/header.jpg?t=1656373119,"Single-player, Steam Achievements, Steam Trading Cards, In-App Purchases, Steam Cloud","Casual, Free To Play, Indie"
"Form your own game studio set in the early 1980s in a small garage. Develop your own game ideas, create a team and develop megahit video games. Research new technologies, train your staff and upgrade your office space, going from a lowly garage to a huge building. Expand your business and dominate the world market for video games!",https://shared.akamai.steamstatic.com/store_item_assets/steam/apps/341000/header.jpg?t=1740737867,"Single-player, Steam Achievements, Family Sharing","Casual, Indie, Simulation, Strategy"
