short_description,header_image,categories,genres
"Experience the most exciting and fast-paced FPS gameplay while competing with players from around the world in over 100 arenas, a dozen game modes, and with persistent career stats tracking, in this online features-focused successor to Quake III Arena.",https://shared.akamai.steamstatic.com/store_item_assets/steam/apps/282440/header.jpg?t=1742481724,"Single-player, Multi-player, Steam Achievements, Steam Trading Cards, Steam Workshop, Partial Controller Support, Steam Cloud, Stats, Family Sharing",Action
"Florence Yeoh feels a little... stuck. Her life is an endless routine of work, sleep, and spending too much time on social media. Then one day, she meets a cello player named Krish who changes everything about how she sees the world and herself.",https://shared.akamai.steamstatic.com/store_item_assets/steam/apps/1102130/header.jpg?t=1729099629,"Single-player, Steam Achievements, Full controller support, Steam Trading Cards, Steam Cloud, Family Sharing","Adventure, Casual, Indie"
"An action RPG based on Chinese art style, as the 7th lineal sequel of this series, it earns a lot of anicipations. Better gaming experience than any of its previous episode will be brought to all the players.",https://shared.akamai.steamstatic.com/store_item_assets/steam/apps/1543030/header.jpg?t=1752806749,"Single-player, Steam Achievements, Full controller support, Steam Trading Cards, Steam Cloud, Family Sharing","Action, Adventure, RPG"
"Shop Titans is the ultimate RPG shopkeeper simulation. Craft powerful equipment, stock your shop and sell to aspiring heroes… at a markup! Hire heroes and explore dungeons to gather valuable materials to craft with. There’s never a dull moment in the world of Shop Titans!",https://shared.akamai.steamstatic.com/store_item_assets/steam/apps/1258080/8c0601da3ee8fc826c62193888e77554b7934795/header.jpg?t=1754432193,"Single-player, Multi-player, MMO, Co-op, Online Co-op, Cross-Platform Multiplayer, Steam Achievements, Steam Trading Cards, In-App Purchases","Adventure, Casual, RPG, Simulation, Free To Play"
"Have you ever dreamt of being a superhero? Meet Chris, a creative and imaginative 9 year old boy who escapes reality with fantastical adventures as his alter ego, the Awesome Captain Spirit! Captain Spirit is a free demo set in the Life is Strange universe. Contains links to Life is Strange 2",https://shared.akamai.steamstatic.com/store_item_assets/steam/apps/845070/header.jpg?t=1728485234,"Single-player, Full controller support, Steam Cloud, Remote Play on TV, Family Sharing","Adventure, Free To Play"
"Rogue Legacy 2 is what you'd get if you mashed Rogue Legacy and a sequel together. Every time you die, your children will succeed you, and each child is unique. Your daughter might be a Colourblind Archer, and your son could be a Pacifistic Chef. Either way, one of them is getting conscripted.",https://shared.akamai.steamstatic.com/store_item_assets/steam/apps/1253920/header.jpg?t=1710829748,"Single-player, Steam Achievements, Full controller support, Steam Trading Cards, Steam Cloud, Remote Play on Tablet, Family Sharing","Action, Adventure, Indie, RPG"
"GoreBox is a chaotic physics-driven sandbox where creativity meets destruction. Use the Reality Crusher to spawn, manipulate, and obliterate anything. Customize, battle with friends, roleplay, or face devious creatures. In this world, your imagination rules—and chaos is your playground!",https://shared.akamai.steamstatic.com/store_item_assets/steam/apps/2027330/header.jpg?t=1734826638,"Single-player, Multi-player, PvP, Online PvP, Co-op, Online Co-op, Cross-Platform Multiplayer, Includes level editor","Action, Casual, Indie, Simulation"
Bomb Rush Cyberfunk is 1 second per second of advanced funkstyle. Battle rival crews and dispatch militarized police to conquer the five boroughs of New Amsterdam. Become All City.,https://shared.akamai.steamstatic.com/store_item_assets/steam/apps/1353230/header.jpg?t=1749851384,"Single-player, Steam Achievements, Full controller support, Steam Cloud, Family Sharing","Action, Adventure, Indie"
"Griftlands is a deck-building roguelite where you negotiate, fight, steal or otherwise persuade others to get your way. Every decision is important, be it the jobs you take, the friends you make, or the cards you collect.",https://shared.akamai.steamstatic.com/store_item_assets/steam/apps/601840/header.jpg?t=1772564680,"Single-player, Steam Workshop, Partial Controller Support, Steam Cloud, Remote Play on Tablet, Family Sharing",Indie
"You have 3 weeks to get a date for Monster Prom! Go through absurd and funny situations, raise your stats and seduce one of your classmates. Beautiful art, bold, unapologetic dialogue and hard choices make up this Multiplayer (1-4 players) Dating Sim. Be your worst self.",https://shared.akamai.steamstatic.com/store_item_assets/steam/apps/743450/header.jpg?t=1747133303,"Single-player, Multi-player, PvP, Online PvP, Shared/Split Screen PvP, Shared/Split Screen, Steam Achievements, Steam Trading Cards, Partial Controller Support, Remote Play on Phone, Remote Play on Tablet, Remote Play Together, Family Sharing","Indie, Simulation"
"Teenage Mutant Ninja Turtles: Shredder’s Revenge reunites Leonardo, Michelangelo, Donatello and Raphael as they kick shell in a beautifully realized beat ’em up.",https://shared.akamai.steamstatic.com/store_item_assets/steam/apps/1361510/header.jpg?t=1744957985,"Single-player, Multi-player, Co-op, Online Co-op, Shared/Split Screen Co-op, Shared/Split Screen, Steam Achievements, Full controller support, Steam Trading Cards, Steam Cloud, Remote Play Together, Family Sharing","Action, Adventure, Casual, Indie"
"Command massive armies in this epic mech auto-battler. Draft your troops, customize your units, master your formations, and crush enemies in spectacular 3D battles. All strategy, no clickfest. Outsmart opponents in 1v1, 2v2, free-for-all, or Survival Mode.",https://shared.akamai.steamstatic.com/store_item_assets/steam/apps/669330/f3f37756ab2d419f107d9656d04a4b5311a108fe/header.jpg?t=1776157576,"Single-player, Multi-player, PvP, Online PvP, Co-op, Online Co-op, Family Sharing","Action, Indie, Massively Multiplayer, Simulation, Strategy"
Fast multiplayer action set in the Half-Life 2 universe! HL2's physics adds a new dimension to deathmatch play. Play straight deathmatch or try Combine vs. Resistance teamplay. Toss a toilet at your friend today!,https://shared.akamai.steamstatic.com/store_item_assets/steam/apps/320/header.jpg?t=1749481506,"Multi-player, Custom Volume Controls, Playable without Timed Input, Stereo Sound, Surround Sound, Valve Anti-Cheat enabled, Includes Source SDK, Family Sharing",Action
"You are a gun for hire, trapped in a war-torn African state, stricken with malaria and forced to make deals with corrupt warlords on both sides of the conflict in order to make this country your home. You must identify and exploit your enemies' weaknesses, neutralizing their superior numbers and firepower with surprise, subversion,...",https://shared.akamai.steamstatic.com/store_item_assets/steam/apps/19900/header.jpg?t=1709317476,"Single-player, Multi-player, Family Sharing",Action
"This game is a brand-new entry in the OCTOPATH TRAVELER series, the first installment of which was initially released in 2018 and sold over 3 million copies worldwide.",https://shared.akamai.steamstatic.com/store_item_assets/steam/apps/1971650/header.jpg?t=1775032200,"Single-player, Steam Achievements, Full controller support, Steam Trading Cards, Camera Comfort, Color Alternatives, Custom Volume Controls, Keyboard Only Option, Playable without Timed Input, Stereo Sound, Steam Cloud, Family Sharing",RPG
"BIOMUTANT® is an open-world, post-apocalyptic Kung-Fu fable RPG, with a unique martial arts styled combat system allowing you to mix melee, shooting and mutant ability action.",https://shared.akamai.steamstatic.com/store_item_assets/steam/apps/597820/header.jpg?t=1696421418,"Single-player, Steam Achievements, Full controller support, Steam Trading Cards, Steam Cloud, Remote Play on Tablet, Family Sharing","Action, RPG"
"Uncover one of history’s greatest mysteries in a first-person, single-player adventure. The year is 1937, sinister forces are scouring the globe for the secret to an ancient power connected to the Great Circle, and only one person can stop them - Indiana Jones™.",https://shared.akamai.steamstatic.com/store_item_assets/steam/apps/2677660/151ae5a881f05ef630defef85d99b38146b7055c/header.jpg?t=1763745007,"Single-player, Steam Achievements, Full controller support, Steam Trading Cards, Captions available, Color Alternatives, Custom Volume Controls, Adjustable Difficulty, Playable without Timed Input, Surround Sound, Steam Cloud, HDR available, Family Sharing","Action, Adventure"
A neon-noir story in a rain-drenched cyberpunk metropolis. It’s your first night on the job working for the Cloudpunk delivery service. Two rules: Don’t miss a delivery and don’t ask what’s in the package.,https://shared.akamai.steamstatic.com/store_item_assets/steam/apps/746850/header.jpg?t=1729027817,"Single-player, Steam Achievements, Full controller support, Steam Cloud, Family Sharing","Adventure, Indie, RPG"
Forge your weapon and follow the path of the Jedi Jedi Knight: Jedi Academy is the latest installment of the highly acclaimed Jedi Knight series. Take on the role of a new student eager to learn the ways of the Force from Jedi Master Luke Skywalker.,https://shared.akamai.steamstatic.com/store_item_assets/steam/apps/6020/header.jpg?t=1741814908,"Single-player, Multi-player, PvP, Online PvP, Shared/Split Screen PvP, Partial Controller Support, Steam Cloud, Remote Play Together, Family Sharing",Action
"Fight your way through an exciting action-adventure game, inspired by classic dungeon crawlers and set in the Minecraft universe!",https://shared.akamai.steamstatic.com/store_item_assets/steam/apps/1672970/header.jpg?t=1717003107,"Single-player, Multi-player, Co-op, Online Co-op, Shared/Split Screen Co-op, Shared/Split Screen, Cross-Platform Multiplayer, Steam Achievements, Full controller support, Steam Trading Cards, Family Sharing","Action, Adventure, RPG"
"Garfield, the famous lasagna-loving cat is back to take on Jon, Odie and company in a no-holds-barred racing game!",https://shared.akamai.steamstatic.com/store_item_assets/steam/apps/1085510/b124a0dbf4fdc5b984268f92921f246ecba04c9c/header.jpg?t=1750323385,"Multi-player, PvP, Online PvP, Shared/Split Screen PvP, Shared/Split Screen, Steam Achievements, Full controller support, Steam Cloud, Remote Play Together, Family Sharing",Racing
"DR LIVESEY: AHAHAHAHAHAHAHAHAHAHHA, gentlemen, from now on, rom and death means the same thing for you.",https://shared.akamai.steamstatic.com/store_item_assets/steam/apps/2181930/header.jpg?t=1745445998,"Single-player, Steam Achievements, Steam Trading Cards, Color Alternatives, Custom Volume Controls, Playable without Timed Input, Stereo Sound, Surround Sound, Stats, Steam Leaderboards, Family Sharing","Action, Adventure, Indie, RPG, Simulation"
"Have you got what it takes to become the manager of a high-performance motorsport team? Motorsport Manager is a highly detailed, best-in-class management game for fans of motorsport. You’ll hire the drivers, build the cars and embed yourself in the dynamic world of racing.",https://shared.akamai.steamstatic.com/store_item_assets/steam/apps/415200/b51d005e6cc79f7442a79c9754a58db28e4a3569/header.jpg?t=1775831343,"Single-player, Steam Achievements, Steam Trading Cards, Steam Workshop, Steam Cloud, Family Sharing","Racing, Simulation, Sports, Strategy"
"Lead your band of mercenaries in the land of Gloomhaven, work with unsavoury individuals, shape the fate of the region, fight your way through horrific places and get rich or die trying in this ruthless Tactical-RPG.",https://shared.akamai.steamstatic.com/store_item_assets/steam/apps/780290/header.jpg?t=1774280168,"Single-player, Multi-player, Co-op, Online Co-op, Full controller support, Steam Trading Cards, Steam Workshop, Steam Cloud, Includes level editor, Family Sharing","Adventure, RPG, Strategy"
"A Little to the Left is a cozy puzzle game that has you sort, stack, and organize household items into pleasing arrangements while you keep an eye out for a mischievous cat with an inclination for chaos. Check out this playful and intuitive puzzler with 100+ satisfying messes to tidy.",https://shared.akamai.steamstatic.com/store_item_assets/steam/apps/1629520/header.jpg?t=1773334043,"Single-player, Steam Achievements, Full controller support, Steam Trading Cards, Camera Comfort, Color Alternatives, Custom Volume Controls, Adjustable Difficulty, Keyboard Only Option, Mouse Only Option, Playable without Timed Input, Touch Only Option, Steam Cloud, Family Sharing","Casual, Indie"
A relaxing idle-farming simulator that sits at the bottom of your screen while you do other things.,https://shared.akamai.steamstatic.com/store_item_assets/steam/apps/2666510/1b9c3e5c1a8a08354bed63fbeed798fcec74aff9/header.jpg?t=1765047200,"Single-player, Steam Achievements, Steam Trading Cards, Adjustable Text Size, Custom Volume Controls, Playable without Timed Input, Save Anytime, Steam Cloud, Family Sharing","Casual, Indie, Simulation, Strategy"
"Kick some grass in Plants vs. Zombies: Battle for Neighborville, the wackiest shooter yet!",https://shared.akamai.steamstatic.com/store_item_assets/steam/apps/1262240/header.jpg?t=1772707517,"Single-player, Multi-player, PvP, Online PvP, Steam Achievements, Full controller support","Action, Casual, Strategy"
"Business is booming for La Soleil, the patisserie run by Kashou Minaduki with his two catgirls, Chocola and Vanilla, his sister Shigure, and the Minaduki family's four catgirl sisters.",https://shared.akamai.steamstatic.com/store_item_assets/steam/apps/420110/header.jpg?t=1656892360,"Single-player, Steam Achievements, Steam Trading Cards, Steam Cloud, Family Sharing","Casual, Indie"
"Throw your toys into your fire, and play with them as they burn. An adventure that takes place almost entirely in front of a fireplace - about looking up up up out of the chimney, and the cold world just on the other side of the wall. From the creators of World of Goo and Human Resource Machine.",https://shared.akamai.steamstatic.com/store_item_assets/steam/apps/221260/header.jpg?t=1668741117,"Single-player, Steam Achievements, Steam Trading Cards, Steam Cloud, Family Sharing","Adventure, Casual, Indie"
"Become Undisputed in the most authentic boxing game to date! Featuring true to life visuals, bone-jarring action, and more licensed boxers than ever before, Undisputed gives you unprecedented control to master every inch of the ring.",https://shared.akamai.steamstatic.com/store_item_assets/steam/apps/1451190/header.jpg?t=1766067946,"Single-player, Multi-player, PvP, Online PvP, Shared/Split Screen PvP, Shared/Split Screen, Steam Achievements, Camera Comfort, Color Alternatives, Custom Volume Controls, Adjustable Difficulty, Playable without Timed Input, Stereo Sound, Partial Controller Support, Steam Cloud, Remote Play Together, Family Sharing","Action, Simulation, Sports"
"The latest entry in the Sakura series is more action-packed than ever before! Sakura Clickers is a fast-paced, exciting adventure, full of content, in which you defeat your foes with the power of your mouse!",https://shared.akamai.steamstatic.com/store_item_assets/steam/apps/383080/header.jpg?t=1578342456,"Single-player, Steam Trading Cards, Steam Cloud","Casual, Free To Play, Indie"
"Aurora, a young girl from 1895 Austria, awakens on the lost fairytale continent of Lemuria. To return home she must fight against the dark creatures of the Queen of the Night, who have stolen the sun, the moon and the stars. At stake is not only Lemuria, but Aurora’s true destiny.",https://shared.akamai.steamstatic.com/store_item_assets/steam/apps/256290/header.jpg?t=1694554365,"Single-player, Multi-player, Shared/Split Screen, Partial Controller Support, Remote Play on Phone, Remote Play on Tablet, Remote Play Together, Family Sharing",RPG
"Slice, burn, toss, zap, grind and gib massive hordes of repugnant orcs in this long-awaited successor to the award-winning Orcs Must Die! series.",https://shared.akamai.steamstatic.com/store_item_assets/steam/apps/1522820/header.jpg?t=1726499308,"Single-player, Multi-player, Co-op, Online Co-op, Steam Achievements, Full controller support, Steam Trading Cards, Steam Cloud, Steam Leaderboards, Remote Play on TV, Family Sharing","Action, Adventure, Indie, Strategy"
"Experience a galaxy of Worlds made entirely from LEGO bricks. EXPLORE gigantic landscapes, DISCOVER countless surprises, and CREATE anything you can imagine by building with LEGO bricks.",https://shared.akamai.steamstatic.com/store_item_assets/steam/apps/332310/header.jpg?t=1745540769,"Single-player, Multi-player, PvP, Online PvP, Co-op, Online Co-op, Shared/Split Screen, Steam Achievements, Full controller support, Remote Play on Phone, Remote Play on Tablet, Remote Play on TV, Remote Play Together, Family Sharing",Adventure
"Don the Ancient Mask. Wield the power of gods. Possess any of your tribespeople, recruit followers, and build a thriving automated civilization. Survive, expand, and forge your own legacy across a vast ancient open world — together with friends.",https://shared.akamai.steamstatic.com/store_item_assets/steam/apps/2646460/23b769b6bc3cbb2fd32aed4ee20e5a3d8e1d0f31/header_alt_assets_29.jpg?t=1776398867,"Single-player, Multi-player, PvP, Online PvP, LAN PvP, Co-op, Online Co-op, LAN Co-op, Steam Achievements, Steam Workshop, Partial Controller Support, Steam Cloud, Family Sharing","Adventure, Indie, RPG, Simulation, Free To Play"
SYNTHETIK is an unforgiving tactical shooter rogue-lite where freedom and experimentation is key. Fight in a world overrun by the Machine Legion and their Gods. Experience the next level in gun-play and dive into unparalleled build options and Android upgrades. Can you defeat the Heart of Armageddon?,https://shared.akamai.steamstatic.com/store_item_assets/steam/apps/528230/header.jpg?t=1707857791,"Single-player, Multi-player, Co-op, Online Co-op, Full controller support, Steam Trading Cards, Family Sharing","Action, Indie"
Five Nights at Freddy’s: Help Wanted is a collection of classic and original mini-games set in the Five Nights universe. Experience the horror in flat (non-VR) mode or VR. Oculus Rift and HTC Vive are supported. A VR Headset is NOT required to play.,https://shared.akamai.steamstatic.com/store_item_assets/steam/apps/732690/header.jpg?t=1686587846,"Single-player, Steam Achievements, Tracked Controller Support, VR Supported, Partial Controller Support, Family Sharing","Action, Casual"
"The unique cyberpunk-meets-fantasy world of Shadowrun has gained a huge cult following since its creation nearly 25 years ago. Now, creator Jordan Weisman returns to the world of Shadowrun, modernizing this classic game setting as a single player, turn-based tactical RPG.",https://shared.akamai.steamstatic.com/store_item_assets/steam/apps/234650/header.jpg?t=1709809316,"Single-player, Steam Trading Cards, Steam Workshop, Steam Cloud, Includes level editor, Remote Play on Tablet, Family Sharing","Adventure, Indie, RPG, Strategy"
"Join the grid and Be One of the 20. Drive like the greatest in EA SPORTS™ F1® 24, the official video game of the 2024 FIA Formula One World Championship™.",https://shared.akamai.steamstatic.com/store_item_assets/steam/apps/2488620/header.jpg?t=1748912330,"Single-player, Multi-player, PvP, Online PvP, LAN PvP, Shared/Split Screen PvP, Co-op, Online Co-op, LAN Co-op, Shared/Split Screen, Steam Achievements, Full controller support, VR Supported, Steam Workshop, In-App Purchases, Adjustable Difficulty, Keyboard Only Option, Playable without Timed Input, Stereo Sound, Surround Sound, Steam Cloud, HDR available, Family Sharing","Racing, Sports"
"Chernobylite is a science-fiction survival horror RPG. Set in the hyper-realistic, 3D-scanned wasteland of Chernobyl’s Exclusion Zone, explore a non-linear storyline in your search to uncover the truth of your tortured past.",https://shared.akamai.steamstatic.com/store_item_assets/steam/apps/1016800/header.jpg?t=1741257112,"Single-player, Steam Achievements, Full controller support, Steam Trading Cards, Steam Cloud, Remote Play on TV, Family Sharing","Action, Adventure, Indie, RPG, Simulation"
"Detention is an atmospheric horror game set in 1960s Taiwan under martial law. Incorporated religious elements based in Taiwanese/Chinese culture and mythology, the game provided players with unique graphics and gaming experience.",https://shared.akamai.steamstatic.com/store_item_assets/steam/apps/555220/header.jpg?t=1574836686,"Single-player, Steam Achievements, Steam Trading Cards, Steam Cloud, Remote Play on Phone, Remote Play on Tablet, Family Sharing","Adventure, Indie"
"Plunge into a dark fantasy Action-RPG, harnessing powerful magic alongside a satisfying combat system. When the tyrannical god, Adyr, invades the human realm seeking vengeance for his imprisonment, humanity calls upon an unlikely defender… a convicted sinner named Harkyn.",https://shared.akamai.steamstatic.com/store_item_assets/steam/apps/265300/header.jpg?t=1728377554,"Single-player, Steam Achievements, Steam Trading Cards, Partial Controller Support, Steam Cloud, Family Sharing","Action, RPG"
"Dungeon of the ENDLESS™ is a Rogue-Like Dungeon-Defense game, in which the player and their team of heroes must protect the generator of their crashed ship while exploring an ever-expanding dungeon, all while facing waves of monsters and special events as they try to find their way out...",https://shared.akamai.steamstatic.com/store_item_assets/steam/apps/249050/header.jpg?t=1762448284,"Single-player, Multi-player, Co-op, Online Co-op, Steam Achievements, Steam Trading Cards, Partial Controller Support, Steam Cloud, Family Sharing","Adventure, Indie, RPG, Strategy"
"Bad Rats is a physics puzzle game where rats finally get their bloody revenge on their new prisoners: The cats. Come up with creative solutions for each puzzle using physics, functional objects, and your specially trained Rats. Try different ways of solving each puzzle to finish faster or earn higher scores.",https://shared.akamai.steamstatic.com/store_item_assets/steam/apps/34900/header.jpg?t=1759942076,"Single-player, Steam Achievements, Steam Trading Cards, Family Sharing",Indie
"Sunset Overdrive transforms an open-world apocalypse into your tactical playground. Zip, grind and wall-run across Sunset City with an unconventional arsenal. Hyper-agility, unique weapons, and customizable abilities deliver an explosive and irreverent adventure in the end times.",https://shared.akamai.steamstatic.com/store_item_assets/steam/apps/847370/header.jpg?t=1667851405,"Single-player, Steam Achievements, Full controller support, Steam Trading Cards, Steam Cloud, Remote Play on TV, Family Sharing","Action, Adventure"
"Return to an apocalyptic Earth in Darksiders III, a hack-n-slash Action Adventure where players assume the role of FURY in her quest to hunt down and dispose of the Seven Deadly Sins. The most enigmatic of the Four Horsemen, FURY must bring balance to the forces that now ravage Earth.",https://shared.akamai.steamstatic.com/store_item_assets/steam/apps/606280/header.jpg?t=1754079090,"Single-player, Steam Achievements, Full controller support, Steam Trading Cards, Steam Cloud, Remote Play on Phone, Remote Play on Tablet, Remote Play on TV, Family Sharing","Action, Adventure, RPG"
"NASA has once again landed on the lunar surface with the goal of colonization, research, and further exploration. Shortly after the return to the Moon, NASA has established a small outpost on the south pole of the moon called Moonbase Alpha.",https://shared.akamai.steamstatic.com/store_item_assets/steam/apps/39000/header.jpg?t=1447352605,"Single-player, Multi-player, Co-op, Valve Anti-Cheat enabled, Stats, Steam Leaderboards","Adventure, Simulation, Strategy"
"War of Rights is a first person multiplayer game featuring massive 400 player battles with a focus on historical authenticity, teamplay and immersion. It is set during the perilous days of the American Civil War, in the Maryland Campaign of September, 1862.",https://shared.akamai.steamstatic.com/store_item_assets/steam/apps/424030/header.jpg?t=1774370458,"Multi-player, MMO, PvP, Online PvP, Co-op, Online Co-op, Steam Achievements, Steam Trading Cards, Partial Controller Support, Steam Cloud, Stats, Family Sharing","Action, Indie, Massively Multiplayer, Simulation, Strategy, Early Access"
"The critically acclaimed Valkyria Chronicles is now available on PC in 1080p True HD, including all previously released DLC!",https://shared.akamai.steamstatic.com/store_item_assets/steam/apps/294860/header.jpg?t=1769644498,"Single-player, Steam Achievements, Full controller support, Steam Trading Cards, Steam Cloud, Family Sharing","Action, RPG, Strategy"
"Welcome to the most delicious dating simulator ever created. Do you have what it takes to be the business partner of and win the heart of the most famous chicken salesman of all time? Play to find out! Go ahead, Colonel Sanders is waiting.",https://shared.akamai.steamstatic.com/store_item_assets/steam/apps/1121910/header.jpg?t=1569326440,"Single-player, Remote Play on Phone, Remote Play on Tablet","Casual, Indie, Simulation"
