short_description,header_image,categories,genres
"For over two decades, Counter-Strike has offered an elite competitive experience, one shaped by millions of players from across the globe. And now the next chapter in the CS story is about to begin. This is Counter-Strike 2.",https://shared.akamai.steamstatic.com/store_item_assets/steam/apps/730/header.jpg?t=1749053861,"Multi-player, Cross-Platform Multiplayer, Steam Trading Cards, Steam Workshop, In-App Purchases, Adjustable Text Size, Camera Comfort, Color Alternatives, Custom Volume Controls, Playable without Timed Input, Stereo Sound, Surround Sound, Valve Anti-Cheat enabled, Stats, Remote Play on Phone, Remote Play on Tablet, Remote Play on TV, Steam Timeline","Action, Free To Play"
"The only aim in Rust is to survive. Everything wants you to die - the island’s wildlife, other inhabitants, the environment, and other survivors. Do whatever it takes to last another night.",https://shared.akamai.steamstatic.com/store_item_assets/steam/apps/252490/header.jpg?t=1776257232,"Multi-player, MMO, PvP, Online PvP, Co-op, Online Co-op, Cross-Platform Multiplayer, Steam Achievements, Steam Trading Cards, Steam Workshop, In-App Purchases, Adjustable Text Size, Camera Comfort, Color Alternatives, Custom Volume Controls, Adjustable Difficulty, Stereo Sound, Subtitle Options, Surround Sound, Valve Anti-Cheat enabled, Stats, Remote Play on Tablet","Action, Adventure, Indie, Massively Multiplayer, RPG"
"Baldur’s Gate 3 is a story-rich, party-based RPG set in the universe of Dungeons &amp; Dragons, where your choices shape a tale of fellowship and betrayal, survival and sacrifice, and the lure of absolute power.",https://shared.akamai.steamstatic.com/store_item_assets/steam/apps/1086940/48a2fcbda8565bb45025e98fd8ebde8a7203f6a0/header.jpg?t=1773079016,"Single-player, Multi-player, Co-op, Online Co-op, LAN Co-op, Cross-Platform Multiplayer, Steam Achievements, Full controller support, Steam Trading Cards, Adjustable Text Size, Camera Comfort, Color Alternatives, Custom Volume Controls, Adjustable Difficulty, Playable without Timed Input, Save Anytime, Stereo Sound, Subtitle Options, Surround Sound, Steam Cloud, Remote Play on TV, Remote Play Together, Family Sharing","Adventure, RPG, Strategy"
Phasmophobia is a 4 player online co-op psychological horror. Paranormal activity is on the rise and it’s up to you and your team to use all the ghost-hunting equipment at your disposal in order to gather as much evidence as you can.,https://shared.akamai.steamstatic.com/store_item_assets/steam/apps/739630/2601b8de105df29d49b8added03b731a8de8018a/header_alt_assets_8.jpg?t=1774955672,"Single-player, Multi-player, Co-op, Online Co-op, Steam Achievements, Full controller support, Tracked Controller Support, VR Supported, Steam Trading Cards, Camera Comfort, Adjustable Difficulty, Playable without Timed Input, Stereo Sound, Surround Sound, Steam Cloud, Remote Play on Phone, Remote Play on Tablet, Family Sharing","Action, Indie, Early Access"
"Trapped forever in a realm of eldritch evil where even death is not an escape, four determined Survivors face a bloodthirsty Killer in a vicious game of nerve and wits. Pick a side and step into a world of tension and terror with horror gaming's best asymmetrical multiplayer.",https://shared.akamai.steamstatic.com/store_item_assets/steam/apps/381210/97f69c3ff1d7fc1237b7192265066dd4e9acd004/header_alt_assets_7.jpg?t=1773849399,"Multi-player, PvP, Online PvP, Co-op, Online Co-op, Cross-Platform Multiplayer, Steam Achievements, Full controller support, Steam Trading Cards, Color Alternatives, Custom Volume Controls, Stereo Sound, Subtitle Options, Surround Sound, Steam Cloud, Remote Play on Phone, Remote Play on Tablet, Remote Play on TV, Family Sharing",Action
"Stranded on the shores of a mysterious island, you must learn to survive. Use your cunning to kill or tame the primeval creatures roaming the land, and encounter other players to survive, dominate... and escape!",https://shared.akamai.steamstatic.com/store_item_assets/steam/apps/346110/header.jpg?t=1765677889,"Single-player, Multi-player, MMO, Co-op, Steam Achievements, Full controller support, Steam Workshop, Steam Cloud, Valve Anti-Cheat enabled, Includes level editor, Remote Play on Tablet, Family Sharing","Action, Adventure, Indie, Massively Multiplayer, RPG"
Awaken as an unstoppable warrior and battle alongside your friends in this story-driven free-to-play online action game,https://shared.akamai.steamstatic.com/store_item_assets/steam/apps/230410/60ce7425b864dd3c0dd855bfc66004c6f9ca4844/header.jpg?t=1775661175,"Single-player, Multi-player, Co-op, Online Co-op, Cross-Platform Multiplayer, Steam Achievements, Full controller support, Steam Trading Cards, Steam Workshop, In-App Purchases, Camera Comfort, Color Alternatives, Custom Volume Controls, Playable without Timed Input, Stereo Sound, Surround Sound, Remote Play on Phone, Remote Play on Tablet, Remote Play on TV, HDR available","Action, RPG, Free To Play"
"You're a survivor in the zombie infested ruins of society, and must work with your friends and forge alliances to remain among the living.",https://shared.akamai.steamstatic.com/store_item_assets/steam/apps/304930/header.jpg?t=1775157119,"Single-player, Multi-player, PvP, Online PvP, LAN PvP, Co-op, Online Co-op, LAN Co-op, Steam Achievements, Steam Trading Cards, Steam Workshop, In-App Purchases, Camera Comfort, Custom Volume Controls, Adjustable Difficulty, Playable without Timed Input, Stereo Sound, Steam Cloud, Valve Anti-Cheat enabled, Stats, Includes level editor, Remote Play on Tablet","Action, Adventure, Casual, Indie, Free To Play"
"A brutal exploration and survival game for 1-10 players, set in a procedurally-generated purgatory inspired by viking culture. Battle, build, and conquer your way to a saga worthy of Odin’s patronage!",https://shared.akamai.steamstatic.com/store_item_assets/steam/apps/892970/de0bdcf6c008c508a79d8e75eb91fc67f4bebd5d/header.jpg?t=1765967243,"Single-player, Multi-player, Co-op, Online Co-op, Full controller support, Camera Comfort, Custom Volume Controls, Adjustable Difficulty, Save Anytime, Stereo Sound, Steam Cloud, Remote Play on Tablet, Family Sharing","Action, Adventure, Indie, RPG, Early Access"
"First-person action survival game set in a post-apocalyptic open world overrun by flesh-hungry zombies. Roam a city devastated by a mysterious virus epidemic. Scavenge for supplies, craft weapons, and face hordes of the infected.",https://shared.akamai.steamstatic.com/store_item_assets/steam/apps/239140/9d1b810b85ae46a0acbdfddf583ccbb81271183e/header.jpg?t=1776254860,"Single-player, Multi-player, PvP, Online PvP, Co-op, Online Co-op, Steam Achievements, Full controller support, Steam Trading Cards, Steam Workshop, Steam Cloud, Valve Anti-Cheat enabled, Includes level editor, Remote Play on Tablet, Remote Play on TV, Family Sharing","Action, RPG"
"Welcome to a new world! In Monster Hunter: World, the latest installment in the series, you can enjoy the ultimate hunting experience, using everything at your disposal to hunt monsters in a new world teeming with surprises and excitement.",https://shared.akamai.steamstatic.com/store_item_assets/steam/apps/582010/header.jpg?t=1773328926,"Single-player, Multi-player, Co-op, Steam Achievements, Steam Trading Cards, Adjustable Text Size, Camera Comfort, Custom Volume Controls, Keyboard Only Option, Stereo Sound, Surround Sound, Partial Controller Support, Steam Cloud, Stats, Steam Leaderboards, Remote Play on Tablet, HDR available, Family Sharing",Action
"How long can you survive a post-apocalyptic world? A land overrun with an infected &quot;zombie&quot; population, where you compete with other survivors for limited resources. Will you team up with strangers and stay strong together? Or play as a lone wolf to avoid betrayal? This is DayZ – this is your story.",https://shared.akamai.steamstatic.com/store_item_assets/steam/apps/221100/header.jpg?t=1769695513,"Multi-player, MMO, PvP, Online PvP, Co-op, Online Co-op, Steam Achievements, Steam Trading Cards, Steam Workshop, Steam Cloud, Valve Anti-Cheat enabled","Action, Adventure, Massively Multiplayer"
"Winner of more than 200 Game of the Year Awards, The Elder Scrolls V: Skyrim Special Edition brings the epic fantasy to life in stunning detail. The Special Edition includes the critically acclaimed game and add-ons with all-new features.",https://shared.akamai.steamstatic.com/store_item_assets/steam/apps/489830/header.jpg?t=1753715778,"Single-player, Steam Achievements, Playable without Timed Input, Save Anytime, Stereo Sound, Surround Sound, Partial Controller Support, Steam Cloud, Remote Play on Phone, Remote Play on Tablet, Family Sharing",RPG
"Game of the Year - The Game Awards 2019 Best Action Game of 2019 - IGN Carve your own clever path to vengeance in the award winning adventure from developer FromSoftware, creators of Bloodborne and the Dark Souls series. Take Revenge. Restore Your Honor. Kill Ingeniously.",https://shared.akamai.steamstatic.com/store_item_assets/steam/apps/814380/header.jpg?t=1762888662,"Single-player, Steam Achievements, Full controller support, Steam Trading Cards, Steam Cloud, Remote Play on Tablet, Remote Play on TV, Family Sharing","Action, Adventure"
"Defy the god of the dead as you hack and slash out of the Underworld in this rogue-like dungeon crawler from the creators of Bastion, Transistor, and Pyre.",https://shared.akamai.steamstatic.com/store_item_assets/steam/apps/1145360/header.jpg?t=1758127023,"Single-player, Steam Achievements, Full controller support, Steam Trading Cards, Captions available, Steam Cloud, Remote Play on Phone, Remote Play on Tablet, Remote Play on TV, Family Sharing","Action, Indie, RPG"
UNDERTALE! The RPG game where you don't have to destroy anyone.,https://shared.akamai.steamstatic.com/store_item_assets/steam/apps/391540/header.jpg?t=1757349115,"Single-player, Steam Trading Cards, Remote Play on Phone, Remote Play on Tablet, Family Sharing","Indie, RPG"
Dynamic seasons change everything at the world’s greatest automotive festival. Go it alone or team up with others to explore beautiful and historic Britain in a shared open world.,https://shared.akamai.steamstatic.com/store_item_assets/steam/apps/1293830/header.jpg?t=1734336342,"Single-player, Multi-player, PvP, Online PvP, Co-op, Online Co-op, Cross-Platform Multiplayer, Steam Achievements, Full controller support, Steam Trading Cards, Steam Cloud, Family Sharing",Racing
Cities: Skylines is a modern take on the classic city simulation. The game introduces new game play elements to realize the thrill and hardships of creating and maintaining a real city whilst expanding on some well-established tropes of the city building experience.,https://shared.akamai.steamstatic.com/store_item_assets/steam/apps/255710/header.jpg?t=1774972989,"Single-player, Steam Achievements, Steam Trading Cards, Steam Workshop, Steam Cloud, Includes level editor, Remote Play on Tablet, Family Sharing","Simulation, Strategy"
"Experience true combat gameplay in a massive military sandbox. Deploy with a wide variety of single- and multiplayer content, a massive arsenal of modern weapons and vehicles, and limitless opportunities for content creation. Authentic, diverse, open - Arma 3 sends you to war.",https://shared.akamai.steamstatic.com/store_item_assets/steam/apps/107410/header.jpg?t=1772187330,"Single-player, Multi-player, PvP, Online PvP, LAN PvP, Co-op, Online Co-op, LAN Co-op, Steam Achievements, Steam Trading Cards, Captions available, Steam Workshop, Stats, Steam Leaderboards, Includes level editor, Steam Timeline","Action, Simulation, Strategy"
"Respawn Entertainment gives you the most advanced titan technology in its new, single player campaign &amp; multiplayer experience. Combine &amp; conquer with new titans &amp; pilots, deadlier weapons, &amp; customization and progression systems that help you and your titan flow as one unstoppable killing force.",https://shared.akamai.steamstatic.com/store_item_assets/steam/apps/1237970/header.jpg?t=1726160226,"Single-player, Multi-player, PvP, Online PvP, Steam Achievements, Full controller support, Steam Trading Cards, Remote Play on Phone, Remote Play on Tablet, Remote Play on TV",Action
Tomb Raider explores the intense origin story of Lara Croft and her ascent from a young woman to a hardened survivor.,https://shared.akamai.steamstatic.com/store_item_assets/steam/apps/203160/9e67774e97cdd155f287146e62611eb445514ac6/header.jpg?t=1765220424,"Single-player, Multi-player, Steam Achievements, Full controller support, Steam Trading Cards, Steam Cloud, Remote Play on Phone, Remote Play on Tablet, Remote Play on TV, Family Sharing","Action, Adventure"
"You are an Exile, struggling to survive on the dark continent of Wraeclast, as you fight to earn power that will allow you to exact your revenge against those who wronged you. Path of Exile is an online Action RPG set in a dark fantasy world. The game is completely free and will never be pay-to-win.",https://shared.akamai.steamstatic.com/store_item_assets/steam/apps/238960/558fd9078de800b7528a8e96bee0108a8fac17aa/header.jpg?t=1773177577,"Single-player, Multi-player, MMO, PvP, Online PvP, Co-op, Online Co-op, Steam Achievements, Full controller support, Steam Trading Cards, In-App Purchases, Remote Play on Tablet","Action, Adventure, Indie, Massively Multiplayer, RPG, Free To Play"
"A sci-fi colony sim driven by an intelligent AI storyteller. Generates stories by simulating psychology, ecology, gunplay, melee combat, climate, biomes, diplomacy, interpersonal relationships, art, medicine, trade, and more.",https://shared.akamai.steamstatic.com/store_item_assets/steam/apps/294100/76e0613b8197327299d5dbabb0a7fd7828a689a2/header.jpg?t=1776194377,"Single-player, Steam Workshop, Adjustable Text Size, Camera Comfort, Custom Volume Controls, Adjustable Difficulty, Mouse Only Option, Playable without Timed Input, Save Anytime, Partial Controller Support, Steam Cloud, Remote Play on Tablet, Family Sharing","Indie, Simulation, Strategy"
The Literature Club is full of cute girls! Will you write the way into their heart? This game is not suitable for children or those who are easily disturbed.,https://shared.akamai.steamstatic.com/store_item_assets/steam/apps/698780/header.jpg?t=1681943582,"Single-player, Remote Play on Phone, Remote Play on Tablet","Casual, Free To Play, Indie"
Experience a thrilling action RPG set on the supernatural island of Aeternum. Forge your destiny on an adventure filled with danger and opportunity.,https://shared.akamai.steamstatic.com/store_item_assets/steam/apps/1063730/bd98bbdc4fdf388d07afa6ec8d781cb863bccfb0/header.jpg?t=1768500124,"Multi-player, MMO, PvP, Online PvP, Co-op, Online Co-op, Steam Achievements, In-App Purchases, Adjustable Text Size, Camera Comfort, Chat Speech-to-text, Chat Text-to-speech, Color Alternatives, Custom Volume Controls, Keyboard Only Option, Playable without Timed Input, Save Anytime, Stereo Sound, Subtitle Options, Surround Sound, Partial Controller Support","Action, Adventure, Massively Multiplayer, RPG"
"The critically acclaimed RPG that raised the bar, from the creators of Baldur's Gate 3. Gather your party. Master deep, tactical combat. Venture as a party of up to four - but know that only one of you will have the chance to become a God.",https://shared.akamai.steamstatic.com/store_item_assets/steam/apps/435150/3f6ee788cb01bd65097c52399d536eb424b4876f/header.jpg?t=1765811123,"Single-player, Multi-player, PvP, Online PvP, Shared/Split Screen PvP, Co-op, Online Co-op, Shared/Split Screen Co-op, Shared/Split Screen, Steam Achievements, Full controller support, Steam Trading Cards, Captions available, Steam Workshop, Steam Cloud, Includes level editor, Remote Play on Tablet, Remote Play on TV, Remote Play Together, Family Sharing","Adventure, RPG, Strategy"
"Join our growing community as you explore, play, and help craft the future of social VR. Create worlds and custom avatars. Welcome to VRChat.",https://shared.akamai.steamstatic.com/store_item_assets/steam/apps/438100/header.jpg?t=1762366454,"Multi-player, MMO, PvP, Online PvP, Co-op, Online Co-op, Cross-Platform Multiplayer, Full controller support, Tracked Controller Support, VR Supported, In-App Purchases","Adventure, Casual, Massively Multiplayer, Simulation, Sports, Free To Play, Early Access"
"Cuphead is a classic run and gun action game heavily focused on boss battles. Inspired by cartoons of the 1930s, the visuals and audio are painstakingly created with the same techniques of the era, i.e. traditional hand drawn cel animation, watercolor backgrounds, and original jazz recordings.",https://shared.akamai.steamstatic.com/store_item_assets/steam/apps/268910/header.jpg?t=1709068852,"Single-player, Multi-player, Co-op, Shared/Split Screen Co-op, Shared/Split Screen, Steam Achievements, Full controller support, Steam Trading Cards, Steam Cloud, Remote Play on Phone, Remote Play on Tablet, Remote Play on TV, Remote Play Together, Family Sharing","Action, Indie"
"An online co-op horror game with up to 6 players. Locate valuable, fully physics-based objects and handle them with care as you retrieve and extract to satisfy your creator's desires.",https://shared.akamai.steamstatic.com/store_item_assets/steam/apps/3241660/1ea445e044a2d5b09cfa8291350b63ebed6e5741/header.jpg?t=1765552338,"Single-player, Multi-player, Co-op, Online Co-op, Camera Comfort, Custom Volume Controls, Playable without Timed Input, Stereo Sound, Steam Cloud, Family Sharing","Action, Early Access"
"Survival is just the beginning. Six years have passed since the biological disaster in Raccoon City. Leon S. Kennedy, one of the survivors, tracks the president's kidnapped daughter to a secluded European village, where there is something terribly wrong with the locals.",https://shared.akamai.steamstatic.com/store_item_assets/steam/apps/2050650/header.jpg?t=1772502922,"Single-player, Steam Achievements, Full controller support, Steam Trading Cards, Steam Cloud, HDR available, Family Sharing","Action, Adventure"
Counter-Strike: Source blends Counter-Strike's award-winning teamplay action with the advanced technology of Source™ technology.,https://shared.akamai.steamstatic.com/store_item_assets/steam/apps/240/header.jpg?t=1745368575,"Multi-player, Cross-Platform Multiplayer, Steam Achievements, Camera Comfort, Color Alternatives, Custom Volume Controls, Stereo Sound, Subtitle Options, Surround Sound, Steam Cloud, Valve Anti-Cheat enabled, Stats, Includes Source SDK, Family Sharing",Action
"Portal™ is a new single player game from Valve. Set in the mysterious Aperture Science Laboratories, Portal has been called one of the most innovative new games on the horizon and will offer gamers hours of unique gameplay.",https://shared.akamai.steamstatic.com/store_item_assets/steam/apps/400/header.jpg?t=1745368554,"Single-player, Steam Achievements, Full controller support, Captions available, Camera Comfort, Custom Volume Controls, Save Anytime, Stereo Sound, Subtitle Options, Surround Sound, Includes level editor, Includes Source SDK, Commentary available, Remote Play on Phone, Remote Play on Tablet, Family Sharing",Action
"Battlefield™ 1 takes you back to The Great War, WW1, where new technology and worldwide conflict changed the face of warfare forever.",https://shared.akamai.steamstatic.com/store_item_assets/steam/apps/1238840/header.jpg?t=1772707296,"Single-player, Multi-player, PvP, Online PvP, Steam Achievements, Full controller support, Steam Trading Cards, HDR available","Action, Massively Multiplayer"
ULTRAKILL is a fast-paced ultra-violent retro FPS that combines the skill-based style scoring of character action games with the unadulterated carnage inspired by the best shooters of the '90s. Rip apart your foes with varied destructive weaponry and shower in their blood to regain your health.,https://shared.akamai.steamstatic.com/store_item_assets/steam/apps/1229490/header.jpg?t=1774188523,"Single-player, Full controller support, Steam Cloud, Family Sharing","Action, Indie, Early Access"
"Dead Cells is a roguelite, metroidvania inspired, action-platformer. You'll explore a sprawling, ever-changing castle... assuming you’re able to fight your way past its keepers in 2D souls-lite combat. No checkpoints. Kill, die, learn, repeat.",https://shared.akamai.steamstatic.com/store_item_assets/steam/apps/588650/header.jpg?t=1772726488,"Single-player, Steam Achievements, Full controller support, Steam Trading Cards, Steam Workshop, Steam Cloud, Remote Play on Phone, Remote Play on Tablet, Remote Play on TV, Family Sharing","Action, Adventure, Indie"
"Episode 1 now FREE! Life is Strange is an award-winning and critically acclaimed episodic adventure game that allows the player to rewind time and affect the past, present and future.",https://shared.akamai.steamstatic.com/store_item_assets/steam/apps/319630/header.jpg?t=1772725755,"Single-player, Steam Achievements, Full controller support, Steam Trading Cards, Custom Volume Controls, Stereo Sound, Subtitle Options, Steam Cloud, Remote Play on Phone, Remote Play on Tablet, Remote Play on TV, Family Sharing","Action, Adventure"
"Lost, alone and separated from family, a stray cat must untangle an ancient mystery to escape a long-forgotten cybercity and find their way home.",https://shared.akamai.steamstatic.com/store_item_assets/steam/apps/1332010/header.jpg?t=1733260906,"Single-player, Steam Achievements, Full controller support, Steam Trading Cards, Steam Cloud, Remote Play on TV, Family Sharing","Adventure, Indie"
"You’ve fled your home, only to find yourself lost in space with a damaged ship. Your only option is to beam down to the planet below, repair your ship and set off to explore the universe...",https://shared.akamai.steamstatic.com/store_item_assets/steam/apps/211820/3ec8855d056d8695de0256594f893a9e3cb826e3/header.jpg?t=1767622909,"Single-player, Multi-player, PvP, Online PvP, Co-op, Online Co-op, Cross-Platform Multiplayer, Steam Achievements, Steam Trading Cards, Steam Workshop, Family Sharing","Action, Adventure, Casual, Indie, RPG"
"His vengeance against the Gods of Olympus years behind him, Kratos now lives as a man in the realm of Norse Gods and monsters. It is in this harsh, unforgiving world that he must fight to survive… and teach his son to do the same.",https://shared.akamai.steamstatic.com/store_item_assets/steam/apps/1593500/header.jpg?t=1763059412,"Single-player, Steam Achievements, Full controller support, Adjustable Text Size, Camera Comfort, Color Alternatives, Custom Volume Controls, Adjustable Difficulty, Keyboard Only Option, Narrated Game Menus, Playable without Timed Input, Save Anytime, Stereo Sound, Subtitle Options, Surround Sound, Steam Cloud, Remote Play on TV, Family Sharing","Action, Adventure, RPG"
Play with life and discover the possibilities. Unleash your imagination and create a world of Sims that’s wholly unique. Explore and customize every detail from Sims to homes–and much more.,https://shared.akamai.steamstatic.com/store_item_assets/steam/apps/1222670/header.jpg?t=1775065624,"Single-player, Steam Trading Cards, In-App Purchases, Mouse Only Option, Playable without Timed Input, Save Anytime, Stereo Sound, Surround Sound, Remote Play on Tablet","Adventure, Casual, Simulation, Free To Play"
"Discover the open world of Hope County, Montana, besieged by a fanatical doomsday cult. Dive into the action solo or two-player co-op in the story campaign, use a vast arsenal of weapons and allies, and free Hope County from Joseph Seed and his cult.",https://shared.akamai.steamstatic.com/store_item_assets/steam/apps/552520/header.jpg?t=1762190084,"Single-player, Multi-player, Co-op, Online Co-op, Steam Achievements, Steam Trading Cards, Captions available, In-App Purchases, Partial Controller Support, Includes level editor, HDR available","Action, Adventure"
"The ultimate Devil Hunter is back in style, in the game action fans have been waiting for.",https://shared.akamai.steamstatic.com/store_item_assets/steam/apps/601150/header.jpg?t=1768869803,"Single-player, Multi-player, Co-op, Online Co-op, Steam Achievements, Full controller support, Steam Trading Cards, Steam Cloud, Remote Play on TV, HDR available, Family Sharing",Action
Embody the superhuman skill and brutality of a Space Marine. Unleash deadly abilities and devastating weaponry to obliterate the relentless Tyranid swarms. Defend the Imperium in spectacular third-person action in solo or multiplayer modes.,https://shared.akamai.steamstatic.com/store_item_assets/steam/apps/2183900/header.jpg?t=1774004924,"Single-player, Multi-player, PvP, Online PvP, Co-op, Online Co-op, Cross-Platform Multiplayer, Steam Achievements, Full controller support, Steam Trading Cards, Adjustable Text Size, Camera Comfort, Color Alternatives, Custom Volume Controls, Adjustable Difficulty, Stereo Sound, Subtitle Options, Surround Sound, Steam Cloud, Family Sharing","Action, Adventure, RPG"
"From one of gaming's most iconic sagas, Halo is bigger than ever. Featuring an expansive open-world campaign and a dynamic free to play multiplayer experience. ",https://shared.akamai.steamstatic.com/store_item_assets/steam/apps/1240440/2262ffb4f1659df1c1cbf2c70af40560b4fa12e4/header.jpg?t=1774464322,"Multi-player, PvP, Online PvP, LAN PvP, Cross-Platform Multiplayer, Steam Achievements, Full controller support, In-App Purchases, Steam Cloud, Includes level editor, Remote Play on TV","Action, Free To Play"
